{
  "contract_version": "1.0.0",
  "hash_receipt_id": "hashrcpt_01J8ZQK6N3F7T9X2Y4W8V0B1C9",
  "activity_receipt_ref": "actr_01J8ZQK6N3F7T9X2Y4W8V0B1D0",
  "hash_kind": "context_raw_generation_fingerprint",
  "algorithm": "sha256",
  "digest": "3b1f6c2a9e7d4c8a1b0f5e2d6c9a8b7e4f3d2c1a0b9e8d7c6f5a4b3c2d1e0f9a",
  "subject_ref": "rawgen_01J8ZQK6N3F7T9X2Y4W8V0B1CA",
  "construction": "context-rawgen-fingerprint-chain-v1",
  "ordered_member_digests": [
    "3b1f6c2a9e7d4c8a1b0f5e2d6c9a8b7e4f3d2c1a0b9e8d7c6f5a4b3c2d1e0f9a"
  ],
  "computed_at": "2026-08-20T14:07:00Z",
  "computed_by": "fingerprint_raw_generation_activity"
}
